<?xml version="1.0" encoding="UTF-8"?>
<xsd:schema xmlns:xsd="http://www.w3.org/2001/XMLSchema">
    <xsd:element name="warehouses">
        <xsd:complexType>
            <xsd:sequence>
                <xsd:element name="warehouse" minOccurs="1" maxOccurs="unbounded" type="Warehouse"/>
                <xsd:element name="company">
                    <xsd:complexType>
                        <xsd:sequence>
                            <xsd:element name="name" type="xsd:string"/>
                            <xsd:element name="contact" type="Contact"/>
                        </xsd:sequence>
                    </xsd:complexType>
                </xsd:element>
            </xsd:sequence>
        </xsd:complexType>
    </xsd:element>

    <xsd:complexType name="Warehouse">
        <xsd:sequence>
            <xsd:element name="products">
                <xsd:complexType>
                    <xsd:sequence>
                        <xsd:element name="product" type="Product" minOccurs="1"
                                     maxOccurs="unbounded"/>
                    </xsd:sequence>
                </xsd:complexType>
            </xsd:element>
            <xsd:element name="contact" type="Contact"/>
            <xsd:element name="deliveries">
                <xsd:complexType>
                    <xsd:sequence>
                        <xsd:element name="delivery" type="Delivery" minOccurs="0"
                                     maxOccurs="unbounded"/>
                    </xsd:sequence>
                </xsd:complexType>
            </xsd:element>
        </xsd:sequence>
    </xsd:complexType>

    <xsd:complexType name="Delivery">
        <xsd:sequence>
            <xsd:element name="products">
                <xsd:complexType>
                    <xsd:sequence>
                        <xsd:element name="product" type="Product" minOccurs="1"
                                     maxOccurs="unbounded"/>
                    </xsd:sequence>
                </xsd:complexType>
            </xsd:element>
            <xsd:element name="contact" type="Contact"/>
        </xsd:sequence>
        <xsd:attribute name="status" default="pending">
            <xsd:simpleType>
                <xsd:restriction base="xsd:string">
                    <xsd:enumeration value="canceled"/>
                    <xsd:enumeration value="returned"/>
                    <xsd:enumeration value="pending"/>
                    <xsd:enumeration value="finished"/>
                </xsd:restriction>
            </xsd:simpleType>
        </xsd:attribute>
        <xsd:attribute name="cost" type="xsd:double"/>
    </xsd:complexType>

    <xsd:complexType name="Contact">
        <xsd:all>
            <xsd:element name="location" minOccurs="1" maxOccurs="1" type="Location"/>
            <xsd:element name="email" minOccurs="0" type="xsd:string"/>
            <xsd:element name="phone" minOccurs="0" type="xsd:string"/>
        </xsd:all>
    </xsd:complexType>

    <xsd:complexType name="Location">
        <xsd:sequence>
            <xsd:element name="country" type="xsd:string"/>
            <xsd:element name="city" type="xsd:string"/>
            <xsd:element name="address" type="xsd:string"/>
        </xsd:sequence>
    </xsd:complexType>

    <xsd:complexType name="Product">
        <xsd:sequence>
            <xsd:element name="description" type="xsd:string" minOccurs="0" maxOccurs="1"/>
            <xsd:element name="info" type="ContentInfo"/>
        </xsd:sequence>
        <xsd:attribute name="price" type="xsd:double" use="required"/>
        <xsd:attribute name="name" type="xsd:string" use="required"/>
        <xsd:attribute name="quantity" type="xsd:int" use="required"/>

    </xsd:complexType>

    <xsd:complexType name="ContentInfo">
        <xsd:sequence>
            <xsd:element name="fragile" type="xsd:boolean" minOccurs="0" maxOccurs="1"
                         default="false"/>
            <xsd:element name="weight" type="xsd:double"/>
            <xsd:element name="expiry_date" type="xsd:date"/>
            <xsd:element name="type">
                <xsd:simpleType>
                    <xsd:restriction base="xsd:string">
                        <xsd:enumeration value="tool"/>
                        <xsd:enumeration value="seeds"/>
                        <xsd:enumeration value="clothing"/>
                        <xsd:enumeration value="equipment"/>
                        <xsd:enumeration value="structure"/>
                    </xsd:restriction>
                </xsd:simpleType>
            </xsd:element>

        </xsd:sequence>
    </xsd:complexType>
</xsd:schema>

        <!--Всеки
        студент избира и разработва собствен модел на документ за избраната
        от него и одобрена от асистиращите приложна област. За този модел се
        съставя Document Type Definition - DTD или SCHEMA. DTD или SCHEMA
        трябва да съдържа минимум 20 различни елемента и 5 атрибута, с които се
        задава състава и структурата на модела. В документа трябва да има поне две
        различни групи вложени елементи (всяка с най-малко 3 елемента). Групите
        трябва да се срещат 2-3 пъти
        -->