<?xml version="1.0" encoding="UTF-8"?>
<warehouses xmlns:xsi="http://www.w3.org/2001/XMLSchema-instance" xsi:noNamespaceSchemaLocation="warehouses.xsd">
    <owner>
        <name>Агро магазин Владимир Огнянов</name>
        <contact>
            <location>
                <country>Словения</country>
                <city>Марибор</city>
                <address>ул. Главен площад 4</address>
            </location>
            <email>agro_magazin_vladimir_ognyanov1009@outlook.com</email>
        </contact>
    </owner>
    <warehouse>
        <products>
            <product name="трактор" brand="Машиникс">
                <info>
                    <fragile>false</fragile>
                    <price currency="USD">150000</price>
                    <quantity>24</quantity>
                    <weight unit="kg">1500</weight>
                    <expiry_date>2032-05-25</expiry_date>
                    <type>equipment</type>
                </info>
                <notes>идеален за средни площи</notes>
            </product>
            <product name="лопата" brand="АгроИнструмент">
                <info>
                    <fragile>false</fragile>
                    <price currency="BGN">25.5</price>
                    <quantity>12</quantity>
                    <weight unit="kg">2.3</weight>
                    <expiry_date>2028-01-15</expiry_date>
                    <type>tool</type>
                </info>
                <notes>подходяща за градинска работа</notes>
            </product>
        </products>
        <contact>
            <location>
                <country>Сърбия</country>
                <city>Белград</city>
                <address>бул. Краля Александра 25</address>
            </location>
            <email>warehouse_mariya_todorova1239@yahoo.com</email>
            <phone>+808 422-857-552257</phone>
        </contact>
        <deliveries>
            <delivery status="canceled" cost="7813594.5">
                <products>
                    <product name="форма за разсад" brand="СеменАгро">
                        <info>
                            <fragile>true</fragile>
                            <price currency="EUR">50</price>
                            <quantity>14</quantity>
                            <weight unit="kg">2.5</weight>
                            <expiry_date>2026-04-18</expiry_date>
                            <type>equipment</type>
                        </info>
                        <notes>за точни и равномерни посеви</notes>
                    </product>
                    <product name="трактор" brand="Машиникс">
                        <info>
                            <fragile>false</fragile>
                            <price currency="USD">150000</price>
                            <quantity>28</quantity>
                            <weight unit="kg">1500</weight>
                            <expiry_date>2032-05-25</expiry_date>
                            <type>equipment</type>
                        </info>
                        <notes>идеален за средни площи</notes>
                    </product>
                    <product name="защитни очила" brand="ФермерГард">
                        <info>
                            <fragile>true</fragile>
                            <price currency="BGN">10</price>
                            <quantity>9</quantity>
                            <weight unit="g">250</weight>
                            <expiry_date>2032-05-20</expiry_date>
                            <type>clothing</type>
                        </info>
                        <notes>защита от при пръскане</notes>
                    </product>
                    <product name="семена пепино пъпеш" brand="Градинар">
                        <info>
                            <fragile>false</fragile>
                            <price currency="RON">12.99</price>
                            <quantity>4</quantity>
                            <weight unit="g">0.9</weight>
                            <expiry_date>2030-04-10</expiry_date>
                            <type>seeds</type>
                        </info>
                        <notes>медено сладък сорт</notes>
                    </product>
                </products>
                <vendor>
                    <name>Тодор Борисов</name>
                    <contact>
                        <location>
                            <country>Турция</country>
                            <city>Истанбул</city>
                            <address>пл. Таксим 1</address>
                        </location>
                        <email>todor_borisov1727@outlook.com</email>
                        <phone>+34 501-8411-571</phone>
                    </contact>
                </vendor>
            </delivery>
            <delivery status="canceled" cost="673.28">
                <products>
                    <product name="семена от домати" brand="СемеАгро">
                        <info>
                            <fragile>false</fragile>
                            <price currency="EUR">8.5</price>
                            <quantity>8</quantity>
                            <weight unit="g">3</weight>
                            <expiry_date>2025-10-10</expiry_date>
                            <type>seeds</type>
                        </info>
                        <notes>високодобивни сортове</notes>
                    </product>
                    <product name="градски ботуши" brand="ТехноОбувки">
                        <info>
                            <fragile>false</fragile>
                            <price currency="BGN">45</price>
                            <quantity>12</quantity>
                            <weight unit="kg">1.5</weight>
                            <expiry_date>2032-02-20</expiry_date>
                            <type>clothing</type>
                        </info>
                        <notes>удобни и издръжливи при всякакви условия</notes>
                    </product>
                </products>
                <vendor>
                    <name>Тодор Цветков</name>
                    <contact>
                        <location>
                            <country>Румъния</country>
                            <city>Букурещ</city>
                            <address>ул. Липскани 32</address>
                        </location>
                        <email>todor_tsvetkov1308@outlook.com</email>
                        <phone>+240 066-102-55702</phone>
                    </contact>
                </vendor>
            </delivery>
        </deliveries>
    </warehouse>
</warehouses>