<?xml version="1.0" encoding="UTF-8"?>
<warehouses xmlns:xsi="http://www.w3.org/2001/XMLSchema-instance"
    xsi:noNamespaceSchemaLocation="warehouses.xsd">
    <warehouse>
        <products>
            <product brand="Семена Гешев" price="1" name="Домати" quantity="34">
                <info>
                    <fragile>false</fragile>
                    <weight>0.1</weight>
                    <expiry_date>2025-09-24</expiry_date>
                    <type>seeds</type>
                </info>
                <notes>Keep in dry place</notes>
            </product>
            <product name="Круши Гергана" brand="Семена Фермера" price="2.5" quantity="30">
                <info>
                    <fragile>true</fragile>
                    <weight>1</weight>
                    <expiry_date></expiry_date>
                    <type>tool</type>
                </info>
            </product>
        </products>
        <contact>
            <location>
                <country>Bulgaria</country>
                <city>Sofia</city>
                <address>ul.Pencho 1</address>
            </location>
            <phone>+35988-88-77-7777</phone>
        </contact>
        <deliveries>
            <delivery>
                <products>
                    <product brand="Семена Гешев" price="1" name="Домати" quantity="10">
                        <info>
                            <fragile>false</fragile>
                            <weight>0.2</weight>
                            <expiry_date>2027-12-13</expiry_date>
                            <type>seeds</type>
                        </info>
                    </product>
                </products>
                <vendor>
                    <name>Vendors inc.</name>
                    <contact>
                        <location>
                            <country>Bulgaria</country>
                            <city>Sofia</city>
                            <address>ul. Gosho Geshev 34</address>
                        </location>
                        <email>pencho@penchev.com</email>
                        <phone>+73-444-23-44</phone>
                    </contact>
                </vendor>
            </delivery>
        </deliveries>
    </warehouse>
    <company>
        <name>Agro Nursery inc</name>
        <contact>
            <location>
                <country>Bulgaria</country>
                <city>Sofia</city>
                <address>ul.Pencho 1</address>
            </location>
            <email>gosho@gosho.com</email>
        </contact>
    </company>
</warehouses>